{
  "$schema": "../schema/task.schema.json",
  "id": "dependency-cve-audit",
  "name": "Dependency CVE Audit",
  "description": "Inventories third-party dependencies, runs the ecosystem's audit tooling, enriches findings with CVE severity and fix versions, and produces a prioritized upgrade plan.",
  "icon": "shippingbox",
  "category": "code-quality",
  "tags": ["dependencies", "cve", "supply-chain", "audit", "sbom", "vulnerability"],
  "scope": "global",
  "version": "1.0.0",
  "author": "ClaudeStudio Code Quality Pack",
  "agent": {
    "model": "claude-sonnet-4-5",
    "allowed_tools": ["Read", "Grep", "Glob", "Bash", "WebSearch"],
    "budget_usd": 3.0,
    "isolation": "worktree"
  },
  "inputs": [
    {
      "key": "ecosystem",
      "label": "Package ecosystem",
      "type": "select",
      "required": true,
      "default": "auto",
      "options": [
        { "value": "auto", "label": "Auto-detect" },
        { "value": "npm", "label": "npm / pnpm / yarn" },
        { "value": "pip", "label": "Python (pip / Poetry)" },
        { "value": "cargo", "label": "Rust (Cargo)" },
        { "value": "go", "label": "Go modules" },
        { "value": "maven", "label": "Java (Maven / Gradle)" }
      ]
    },
    {
      "key": "include_dev",
      "label": "Include dev dependencies",
      "type": "boolean",
      "required": false,
      "default": true
    },
    {
      "key": "fail_on",
      "label": "Flag as blocking at severity",
      "type": "select",
      "required": true,
      "default": "high",
      "options": [
        { "value": "moderate", "label": "Moderate and above" },
        { "value": "high", "label": "High and above" },
        { "value": "critical", "label": "Critical only" }
      ]
    }
  ],
  "workflow": {
    "steps": [
      {
        "id": "inventory",
        "title": "Inventory dependencies",
        "prompt": "Detect the ecosystem ({{ecosystem}}, 'auto' = infer from manifest/lockfiles) in the repository. Read the manifest and lockfile to inventory direct and transitive dependencies with their resolved versions. Respect include_dev = {{include_dev}}."
      },
      {
        "id": "audit",
        "title": "Run audit tooling",
        "prompt": "Run the appropriate audit command for the ecosystem (e.g. `npm audit --json`, `pip-audit`, `cargo audit`, `govulncheck`, `mvn org.owasp:dependency-check`). Capture results. If no tool is available, fall back to inspecting versions against known-vulnerable ranges. Collect each advisory: package, installed version, vulnerable range, fixed version, advisory id and CVE."
      },
      {
        "id": "enrich",
        "title": "Enrich & prioritize",
        "prompt": "For each finding, confirm or look up the CVE severity (CVSS) and whether a fix version exists. Note whether the dependency is direct or transitive and whether the vulnerable code path is likely reachable. Rank findings, marking anything at or above {{fail_on}} severity as blocking."
      },
      {
        "id": "report",
        "title": "Upgrade plan",
        "prompt": "Produce a Markdown report: 'Summary' (counts by severity, blocking vs non-blocking against {{fail_on}}), 'Findings' table (package / version / CVE / severity / fix version / direct?), and 'Upgrade Plan' (ordered, safe-first, noting breaking-change risk and the exact version to upgrade to). Include the precise commands to apply the upgrades."
      }
    ]
  },
  "output": {
    "type": "report",
    "path": "reports/security/cve-audit-{{date}}.md"
  },
  "schedule": {
    "trigger": "cron",
    "cron": "0 3 * * *",
    "enabled": false
  }
}
